[
  {
    "schema_version": "ng039-observer-events/v2",
    "run_id": "NG039-D2-000000000001",
    "sequence": 1,
    "event": "GATEWAY_STARTED",
    "monotonic_ns": 1000000000,
    "pid": 1234,
    "uid": 1000,
    "resource_type": "process",
    "candidate_key": null,
    "source_name": "ng039_d2_launcher",
    "error_number": null,
    "identity": null
  },
  {
    "schema_version": "ng039-observer-events/v2",
    "run_id": "NG039-D2-000000000001",
    "sequence": 2,
    "event": "TARGET_ADMITTED",
    "monotonic_ns": 1000001000,
    "pid": 1234,
    "uid": 1000,
    "resource_type": "process",
    "candidate_key": 11,
    "source_name": "ng039_d2_launcher",
    "error_number": null,
    "identity": {
      "candidate_key": 11,
      "shmid": 11,
      "creator_pid": 1234,
      "creator_uid": 1000,
      "owner_uid": 1000,
      "size_bytes": 33554432,
      "mode": 438,
      "source_name": "/dev/shm/sem.11",
      "path": "/dev/shm/sem.11",
      "device": 64,
      "inode": 12345,
      "uid": 1000,
      "gid": 1000,
      "nlink": 1,
      "sem_t_address": 140735000000000,
      "map_start": 140735000000000,
      "map_end": 140735000004096,
      "map_device_major": 0,
      "map_device_minor": 1,
      "map_inode": 12345,
      "mapping_line": "/dev/shm/sem.11 00007f8b4c00d000-00007f8b4c011000 rw-s 0000000 00:05 12345 /dev/shm/sem.11"
    }
  },
  {
    "schema_version": "ng039-observer-events/v2",
    "run_id": "NG039-D2-000000000001",
    "sequence": 3,
    "event": "STICKY_FIRST_TARGET_WAIT",
    "monotonic_ns": 1000004000,
    "pid": 1234,
    "uid": 1000,
    "resource_type": "thread",
    "candidate_key": 11,
    "source_name": "ng039_d2_launcher",
    "error_number": null,
    "identity": {
      "candidate_key": 11,
      "shmid": 11,
      "creator_pid": 1234,
      "creator_uid": 1000,
      "owner_uid": 1000,
      "size_bytes": 33554432,
      "mode": 438,
      "source_name": "/dev/shm/sem.11",
      "path": "/dev/shm/sem.11",
      "device": 64,
      "inode": 12345,
      "uid": 1000,
      "gid": 1000,
      "nlink": 1,
      "sem_t_address": 140735000000000,
      "map_start": 140735000000000,
      "map_end": 140735000004096,
      "map_device_major": 0,
      "map_device_minor": 1,
      "map_inode": 12345,
      "mapping_line": "/dev/shm/sem.11 00007f8b4c00d000-00007f8b4c011000 rw-s 0000000 00:05 12345 /dev/shm/sem.11"
    }
  },
  {
    "schema_version": "ng039-observer-events/v2",
    "run_id": "NG039-D2-000000000001",
    "sequence": 4,
    "event": "GATEWAY_STOPPED",
    "monotonic_ns": 1000007000,
    "pid": 1234,
    "uid": 1000,
    "resource_type": "process",
    "candidate_key": null,
    "source_name": "ng039_d2_launcher",
    "error_number": null,
    "identity": null
  }
]
